{
  "schema": "jit-benchmark-v1",
  "provenance": {
    "source_revision": "63dc71666aa564bd11429709f8e1a255719b1777",
    "quickjs_revision": "fd0a0210b7be00957751871e7e01b8291268fc29",
    "source_dirty": false,
    "command": [
      "./target/release/jit-bench",
      "compare",
      "--modes",
      "interpreter,tier1,tier2,automatic",
      "--output",
      "benchmarks/results/m1-arrays-typed.json",
      "--report",
      "benchmarks/results/m1-arrays-typed.md"
    ],
    "target": "x86_64",
    "target_triple": "x86_64-unknown-linux-gnu",
    "os": "linux",
    "kernel": "Linux 7.1.9-arch1-2",
    "cpu": "model name\t: 13th Gen Intel(R) Core(TM) i7-13700KF",
    "power_mode": "powersave",
    "rustc": "rustc 1.98.0 (88d9e12ae 2026-08-18)\nbinary: rustc\ncommit-hash: 88d9e12ae178fab0fb5cc050a94da85685d449ea\ncommit-date: 2026-08-18\nhost: x86_64-unknown-linux-gnu\nrelease: 1.98.0\nLLVM version: 22.1.8",
    "llvm": "rustc 1.98.0 (88d9e12ae 2026-08-18)\nbinary: rustc\ncommit-hash: 88d9e12ae178fab0fb5cc050a94da85685d449ea\ncommit-date: 2026-08-18\nhost: x86_64-unknown-linux-gnu\nrelease: 1.98.0\nLLVM version: 22.1.8",
    "executable_bytes": 7530368,
    "stripped_jit_bytes": 5734600,
    "stripped_no_jit_bytes": 1716448,
    "stripped_jit_delta_bytes": 4018152,
    "schema_sha256": "ae70459701c9799fdd367fe3b720ae2fab457f4dab700e54498ad1f27a13c82c",
    "suites_lock_sha256": "cfa0056fe9ebd94e16b64a9d74b1f94d3f5570d6c5d6388c4126f3ccb8980be3",
    "bun_version": "1.4.0",
    "bun_path": "/home/jason/.bun/bin/bun",
    "bun_sha256": "33d56b070be6a9e3da0ab013038b43d1645d0534ca811ecdba4472599117eb4b"
  },
  "policy": {
    "latency_warmups": 5,
    "latency_processes": 30,
    "throughput_windows": 10,
    "throughput_window_ns": 1000000000,
    "bootstrap_resamples": 10000,
    "pairing": "round-robin interleaved fresh processes; pair_index is the joint resampling unit"
  },
  "modes": [
    {
      "mode": "automatic",
      "workloads": [
        {
          "name": "arrays-typed",
          "suite": "rquickjs-jit matrix",
          "group": "arrays-typed",
          "designated_kernel": false,
          "samples": [
            {
              "pair_index": 0,
              "elapsed_ns": 7655283,
              "checksum": "string:33983000:8496750.000:2000",
              "native_entries": 1,
              "native_exits": 1,
              "fallback_count": 0,
              "retry_count": 0,
              "tier1_entries": 1,
              "tier2_entries": 0,
              "deopt_count": 0,
              "osr_attempts": 1,
              "profitability_evaluations": 10,
              "profitability_approved": 0,
              "profitability_rejected": 10,
              "benefit_recordings": 0,
              "measured_benefit_ns": 0,
              "opcode_fingerprint": 420453823952306295,
              "abi_fingerprint": 1792071232254925412,
              "config_fingerprint": 4005702742960461327,
              "peak_rss_bytes": 13934592,
              "code_bytes": 89616,
              "metadata_bytes": 20709,
              "peak_compiler_bytes": 5940,
              "phases": {
                "total_ns": 30516547,
                "runtime_create_ns": 48138,
                "jit_attach_ns": 198289,
                "context_create_ns": 183846,
                "definition_eval_ns": 111072,
                "first_eval_ns": 1022607,
                "threshold_crossing_ns": 20495504,
                "compile_ns": 20060504,
                "install_ns": 61733,
                "osr_ns": 0,
                "steady_state_ns": 7655283
              }
            },
            {
              "pair_index": 1,
              "elapsed_ns": 7675612,
              "checksum": "string:33983000:8496750.000:2000",
              "native_entries": 0,
              "native_exits": 0,
              "fallback_count": 0,
              "retry_count": 0,
              "tier1_entries": 0,
              "tier2_entries": 0,
              "deopt_count": 0,
              "osr_attempts": 0,
              "profitability_evaluations": 10,
              "profitability_approved": 0,
              "profitability_rejected": 10,
              "benefit_recordings": 0,
              "measured_benefit_ns": 0,
              "opcode_fingerprint": 420453823952306295,
              "abi_fingerprint": 1792071232254925412,
              "config_fingerprint": 4005702742960461327,
              "peak_rss_bytes": 13930496,
              "code_bytes": 89616,
              "metadata_bytes": 20709,
              "peak_compiler_bytes": 5940,
              "phases": {
                "total_ns": 32683871,
                "runtime_create_ns": 41339,
                "jit_attach_ns": 180475,
                "context_create_ns": 148950,
                "definition_eval_ns": 90584,
                "first_eval_ns": 1396182,
                "threshold_crossing_ns": 22357280,
                "compile_ns": 23328421,
                "install_ns": 69101,
                "osr_ns": 0,
                "steady_state_ns": 7675612
              }
            },
            {
              "pair_index": 2,
              "elapsed_ns": 7603569,
              "checksum": "string:33983000:8496750.000:2000",
              "native_entries": 0,
              "native_exits": 0,
              "fallback_count": 0,
              "retry_count": 0,
              "tier1_entries": 0,
              "tier2_entries": 0,
              "deopt_count": 0,
              "osr_attempts": 0,
              "profitability_evaluations": 10,
              "profitability_approved": 0,
              "profitability_rejected": 10,
              "benefit_recordings": 0,
              "measured_benefit_ns": 0,
              "opcode_fingerprint": 420453823952306295,
              "abi_fingerprint": 1792071232254925412,
              "config_fingerprint": 4005702742960461327,
              "peak_rss_bytes": 14041088,
              "code_bytes": 89616,
              "metadata_bytes": 20709,
              "peak_compiler_bytes": 5940,
              "phases": {
                "total_ns": 33321635,
                "runtime_create_ns": 59727,
                "jit_attach_ns": 119913,
                "context_create_ns": 105631,
                "definition_eval_ns": 63877,
                "first_eval_ns": 881966,
                "threshold_crossing_ns": 23689110,
                "compile_ns": 23980819,
                "install_ns": 67131,
                "osr_ns": 0,
                "steady_state_ns": 7603569
              }
            },
            {
              "pair_index": 3,
              "elapsed_ns": 7879642,
              "checksum": "string:33983000:8496750.000:2000",
              "native_entries": 0,
              "native_exits": 0,
              "fallback_count": 0,
              "retry_count": 0,
              "tier1_entries": 0,
              "tier2_entries": 0,
              "deopt_count": 0,
              "osr_attempts": 0,
              "profitability_evaluations": 10,
              "profitability_approved": 0,
              "profitability_rejected": 10,
              "benefit_recordings": 0,
              "measured_benefit_ns": 0,
              "opcode_fingerprint": 420453823952306295,
              "abi_fingerprint": 1792071232254925412,
              "config_fingerprint": 4005702742960461327,
              "peak_rss_bytes": 13975552,
              "code_bytes": 89616,
              "metadata_bytes": 20709,
              "peak_compiler_bytes": 5940,
              "phases": {
                "total_ns": 34753054,
                "runtime_create_ns": 44695,
                "jit_attach_ns": 316642,
                "context_create_ns": 170214,
                "definition_eval_ns": 98613,
                "first_eval_ns": 1466945,
                "threshold_crossing_ns": 23981821,
                "compile_ns": 24853036,
                "install_ns": 70751,
                "osr_ns": 0,
                "steady_state_ns": 7879642
              }
            },
            {
              "pair_index": 4,
              "elapsed_ns": 8257950,
              "checksum": "string:33983000:8496750.000:2000",
              "native_entries": 1,
              "native_exits": 1,
              "fallback_count": 0,
              "retry_count": 0,
              "tier1_entries": 1,
              "tier2_entries": 0,
              "deopt_count": 0,
              "osr_attempts": 0,
              "profitability_evaluations": 10,
              "profitability_approved": 0,
              "profitability_rejected": 10,
              "benefit_recordings": 0,
              "measured_benefit_ns": 0,
              "opcode_fingerprint": 420453823952306295,
              "abi_fingerprint": 1792071232254925412,
              "config_fingerprint": 4005702742960461327,
              "peak_rss_bytes": 13811712,
              "code_bytes": 89616,
              "metadata_bytes": 20709,
              "peak_compiler_bytes": 5940,
              "phases": {
                "total_ns": 32848359,
                "runtime_create_ns": 46363,
                "jit_attach_ns": 170149,
                "context_create_ns": 171104,
                "definition_eval_ns": 89248,
                "first_eval_ns": 1414107,
                "threshold_crossing_ns": 21903086,
                "compile_ns": 21387596,
                "install_ns": 96880,
                "osr_ns": 0,
                "steady_state_ns": 8257950
              }
            },
            {
              "pair_index": 5,
              "elapsed_ns": 7766021,
              "checksum": "string:33983000:8496750.000:2000",
              "native_entries": 0,
              "native_exits": 0,
              "fallback_count": 0,
              "retry_count": 0,
              "tier1_entries": 0,
              "tier2_entries": 0,
              "deopt_count": 0,
              "osr_attempts": 0,
              "profitability_evaluations": 10,
              "profitability_approved": 0,